{
  "contract_version": "ai-sdlc-contract/v1",
  "correlation_id": "portfolio-142-docs-run-1",
  "execution_status": "draft-pr-created",
  "target_repository": "Young-Consultations/consulting-playbook",
  "branch_name": "codex/portfolio-142-docs",
  "pull_request_url": "https://github.com/Young-Consultations/consulting-playbook/pull/57",
  "workflow_url": "https://github.com/Young-Consultations/portfolio-tasks/actions/runs/123456789",
  "validation_result": "passed",
  "test_result": "passed",
  "failure_category": "none",
  "failure_message": null,
  "started_at": "2026-07-26T12:00:00Z",
  "completed_at": "2026-07-26T12:08:30Z"
}
